### ISSUE TITLE
No internet connection. Root CA problem.

### ISSUE THREAD

**Issue by VladimirKrylov** [ProfessorJTJ/HISuite-Proxy#12]
Hello!
HiSuite always says "No Internet connection" through proxy.
I have checked traffic on localhost port 7777 and see Fatal error: Unknown CA.

Frame 14622: 51 bytes on wire (408 bits), 51 bytes captured (408 bits) on interface 0
Null/Loopback
Internet Protocol Version 4, Src: 127.0.0.1, Dst: 127.0.0.1
Transmission Control Protocol, Src Port: 56979, Dst Port: 7777, Seq: 385, Ack: 1293, Len: 7
Hypertext Transfer Protocol
    [Proxy-Connect-Hostname: query.hicloud.com]
    [Proxy-Connect-Port: 443]
Transport Layer Security
    TLSv1.2 Record Layer: Alert (Level: Fatal, Description: Unknown CA)
        Content Type: Alert (21)
        Version: TLS 1.2 (0x0303)
        Length: 2
        Alert Message
            Level: Fatal (2)
            Description: Unknown CA (48)

At very first start application asked to import root CA and I agreed with it.
I have checked this on two PC and result the same.
Do you have any suggestions?

**Comment by VladimirKrylov** [comment]
HiSuite should be 10.1.0.550 version. I tried with an 11 version and it was a mistake. Now it works.
Thank you!
